[{"identity":{"provider":"fixture-provider","account":"fixture-account","workspace":"fixture-workspace","region":"fixture-region","generation":1},"source":"fixture-native-read","observed_at":"2026-10-03T00:00:00Z","received_at":"2026-10-03T00:00:00Z","pool":{"id":"fixture-pool","provider":"fixture-provider","region":"fixture-region","scope":"account","owner":"fixture-account","verified":true},"complete":true,"status":"unknown","windows":[],"resources":[]},{"identity":{"provider":"fixture-provider","account":"fixture-account","workspace":"fixture-workspace","region":"fixture-region","generation":1},"source":"fixture-native-read","observed_at":"2026-10-03T00:00:00Z","received_at":"2026-10-03T00:00:00Z","pool":{"id":"fixture-pool","provider":"fixture-provider","region":"fixture-region","scope":"account","owner":"fixture-account","verified":true},"complete":true,"status":"available","windows":[{"name":"5 hours","kind":"subscription","unit":"percent","used_percent":0,"remaining_percent":100,"span_seconds":null,"reset_at":null,"raw":{"name":"5 hours","used":0}}],"resources":[]},{"identity":{"provider":"fixture-provider","account":"fixture-account","workspace":"fixture-workspace","region":"fixture-region","generation":1},"source":"fixture-native-read","observed_at":"2026-10-03T00:00:00Z","received_at":"2026-10-03T00:00:00Z","pool":{"id":"fixture-pool","provider":"fixture-provider","region":"fixture-region","scope":"account","owner":"fixture-account","verified":true},"complete":true,"status":"zero","windows":[{"name":"","kind":"subscription","unit":"percent","used_percent":100,"remaining_percent":0,"span_seconds":null,"reset_at":null,"raw":{"used":100}}],"resources":[]},{"identity":{"provider":"fixture-provider","account":"fixture-account","workspace":"fixture-workspace","region":"fixture-region","generation":1},"source":"fixture-native-read","observed_at":"2026-10-03T00:00:00Z","received_at":"2026-10-03T00:00:00Z","pool":{"id":"fixture-pool","provider":"fixture-provider","region":"fixture-region","scope":"account","owner":"fixture-account","verified":true},"complete":true,"status":"unknown","windows":[{"name":"","kind":"subscription","unit":"percent","used_percent":null,"remaining_percent":null,"span_seconds":null,"reset_at":null,"raw":{"used":101}}],"resources":[]},{"identity":{"provider":"fixture-provider","account":"fixture-account","workspace":"fixture-workspace","region":"fixture-region","generation":1},"source":"fixture-native-read","observed_at":"2026-10-03T00:00:00Z","received_at":"2026-10-03T00:00:00Z","pool":{"id":"fixture-pool","provider":"fixture-provider","region":"fixture-region","scope":"account","owner":"fixture-account","verified":true},"complete":true,"status":"unknown","windows":[],"resources":[{"kind":"balance","unit":"vendor_display","display":"fixture-20 USD","raw":{"balance":"fixture-20 USD"}}]},{"identity":{"provider":"fixture-provider","account":"fixture-account","workspace":"fixture-workspace","region":"fixture-region","generation":1},"source":"fixture-native-read","observed_at":"2026-10-02T00:00:00Z","received_at":"2026-10-03T00:00:00Z","pool":{"id":"fixture-pool","provider":"fixture-provider","region":"fixture-region","scope":"account","owner":"fixture-account","verified":true},"complete":true,"status":"stale","windows":[{"name":"","kind":"subscription","unit":"percent","used_percent":25,"remaining_percent":75,"span_seconds":null,"reset_at":null,"raw":{"used":25}}],"resources":[]}]
